{
  "id": "listening-sample-01",
  "schemaVersion": 1,
  "title": "Sports Centre, Festival, Urban Birds and Ice Houses",
  "sections": [
    {
      "id": "s1",
      "number": 1,
      "title": "Joining a sports centre",
      "audioUrl": "listening/listening-sample-01/section-1.mp3",
      "durationSeconds": 330,
      "transcript": [
        { "startSeconds": 0, "endSeconds": 18, "speaker": "Receptionist", "text": "Good morning, Riverside Sports Centre. How can I help you?" },
        { "startSeconds": 18, "endSeconds": 38, "speaker": "Daniel", "text": "Hi, I'd like to join. I know the centre on Mill Road is a bit cheaper, but yours is only five minutes' walk from my office, so it's ideal." },
        { "startSeconds": 38, "endSeconds": 45, "speaker": "Receptionist", "text": "Lovely. Can I take your name?" },
        { "startSeconds": 45, "endSeconds": 60, "speaker": "Daniel", "text": "Daniel Hartley. That's H-A-R-T-L-E-Y." },
        { "startSeconds": 60, "endSeconds": 68, "speaker": "Receptionist", "text": "And your postcode?" },
        { "startSeconds": 68, "endSeconds": 85, "speaker": "Daniel", "text": "It's BR4 7TN." },
        { "startSeconds": 85, "endSeconds": 105, "speaker": "Receptionist", "text": "We have full, off-peak and weekend memberships. Full is forty-five pounds a month; off-peak covers weekdays before four in the afternoon." },
        { "startSeconds": 105, "endSeconds": 115, "speaker": "Daniel", "text": "I usually train at lunchtime, so off-peak would suit me." },
        { "startSeconds": 115, "endSeconds": 125, "speaker": "Receptionist", "text": "Then that's thirty-two pounds a month. Which activity are you most interested in?" },
        { "startSeconds": 125, "endSeconds": 160, "speaker": "Daniel", "text": "I used to play squash, but my knee isn't great any more, so it'll mainly be swimming." },
        { "startSeconds": 160, "endSeconds": 168, "speaker": "Receptionist", "text": "When would you like to start?" },
        { "startSeconds": 168, "endSeconds": 175, "speaker": "Daniel", "text": "Could I start on the tenth of March?" },
        { "startSeconds": 175, "endSeconds": 188, "speaker": "Receptionist", "text": "The pool is closed for maintenance that week, so how about the fourteenth?" },
        { "startSeconds": 188, "endSeconds": 195, "speaker": "Daniel", "text": "The fourteenth of March is fine." },
        { "startSeconds": 195, "endSeconds": 235, "speaker": "Receptionist", "text": "On your first visit, please bring proof of address, such as a utility bill. You don't need a photograph; we take one here." },
        { "startSeconds": 235, "endSeconds": 275, "speaker": "Receptionist", "text": "You'll also have an induction with a trainer. It used to take an hour, but now it lasts forty-five minutes." },
        { "startSeconds": 275, "endSeconds": 290, "speaker": "Daniel", "text": "Will my card be posted to me?" },
        { "startSeconds": 290, "endSeconds": 330, "speaker": "Receptionist", "text": "No, we stopped posting cards. You'll collect it at reception when you come in for the induction." }
      ],
      "questionGroups": [
        {
          "id": "s1-g1",
          "type": "sentence_completion",
          "instruction": "Complete the form below. Write NO MORE THAN TWO WORDS AND/OR A NUMBER for each answer.",
          "maxWords": 2,
          "questions": [
            { "id": "q1", "number": 1, "prompt": "Name: Daniel ____", "acceptedAnswers": ["Hartley"] },
            { "id": "q2", "number": 2, "prompt": "Postcode: ____", "acceptedAnswers": ["BR4 7TN"] },
            { "id": "q3", "number": 3, "prompt": "Membership type: ____", "acceptedAnswers": ["off-peak", "off peak"] },
            { "id": "q4", "number": 4, "prompt": "Monthly fee: £____", "acceptedAnswers": ["32", "thirty-two"] },
            { "id": "q5", "number": 5, "prompt": "Main activity: ____", "acceptedAnswers": ["swimming"] },
            { "id": "q6", "number": 6, "prompt": "Start date: ____", "acceptedAnswers": ["14 March", "March 14", "14th March"] }
          ]
        },
        {
          "id": "s1-g2",
          "type": "multiple_choice",
          "instruction": "Choose the correct letter, A, B or C.",
          "questions": [
            {
              "id": "q7",
              "number": 7,
              "prompt": "Why did Daniel choose this sports centre?",
              "options": [
                { "key": "A", "text": "It is close to where he works." },
                { "key": "B", "text": "It is cheaper than other centres." },
                { "key": "C", "text": "It has the largest pool in the area." }
              ],
              "acceptedAnswers": ["A"]
            },
            {
              "id": "q8",
              "number": 8,
              "prompt": "What must Daniel bring on his first visit?",
              "options": [
                { "key": "A", "text": "a photograph" },
                { "key": "B", "text": "proof of address" },
                { "key": "C", "text": "a bank card" }
              ],
              "acceptedAnswers": ["B"]
            },
            {
              "id": "q9",
              "number": 9,
              "prompt": "How long does the induction session last?",
              "options": [
                { "key": "A", "text": "30 minutes" },
                { "key": "B", "text": "45 minutes" },
                { "key": "C", "text": "an hour" }
              ],
              "acceptedAnswers": ["B"]
            },
            {
              "id": "q10",
              "number": 10,
              "prompt": "How will Daniel get his membership card?",
              "options": [
                { "key": "A", "text": "by post" },
                { "key": "B", "text": "by email" },
                { "key": "C", "text": "at reception" }
              ],
              "acceptedAnswers": ["C"]
            }
          ]
        }
      ]
    },
    {
      "id": "s2",
      "number": 2,
      "title": "A community festival",
      "audioUrl": "listening/listening-sample-01/section-2.mp3",
      "durationSeconds": 360,
      "transcript": [
        { "startSeconds": 0, "endSeconds": 35, "speaker": "Organiser", "text": "Thanks for coming to this briefing about the Greenfield Community Festival. Normally we hold it in the town park, but the park is being re-turfed, so this year we're moving to the school field." },
        { "startSeconds": 35, "endSeconds": 70, "speaker": "Organiser", "text": "Gates open at ten for stallholders, but the festival begins officially at eleven, and it runs until late evening." },
        { "startSeconds": 70, "endSeconds": 105, "speaker": "Organiser", "text": "Last year we raised money for the playground. This year every penny goes towards repairs to the community hall roof." },
        { "startSeconds": 105, "endSeconds": 140, "speaker": "Organiser", "text": "Parking near the school is very limited and the station car park will be full, so please come by bus. There will be extra buses every twenty minutes." },
        { "startSeconds": 140, "endSeconds": 175, "speaker": "Organiser", "text": "The food market and the dog show are back, of course, but the big new attraction is a climbing wall, run by instructors from the leisure centre." },
        { "startSeconds": 175, "endSeconds": 210, "speaker": "Organiser", "text": "Children's activities, including face painting, will be in the yellow tent, next to the main stage." },
        { "startSeconds": 210, "endSeconds": 245, "speaker": "Organiser", "text": "Our cooking demonstration was going to be at two, but the chef can only arrive later, so it will now start at three." },
        { "startSeconds": 245, "endSeconds": 280, "speaker": "Organiser", "text": "Volunteers, please wear the green badge you'll receive today, not the blue one from last year." },
        { "startSeconds": 280, "endSeconds": 315, "speaker": "Organiser", "text": "If a child gets lost, staff will take them straight to the information point by the main gate." },
        { "startSeconds": 315, "endSeconds": 360, "speaker": "Organiser", "text": "We decided against fireworks because of the animals nearby, so the festival ends with a lantern display on the field." }
      ],
      "questionGroups": [
        {
          "id": "s2-g1",
          "type": "multiple_choice",
          "instruction": "Choose the correct letter, A, B or C.",
          "questions": [
            {
              "id": "q11",
              "number": 11,
              "prompt": "Where will the festival be held this year?",
              "options": [
                { "key": "A", "text": "in the town park" },
                { "key": "B", "text": "on the high street" },
                { "key": "C", "text": "on the school field" }
              ],
              "acceptedAnswers": ["C"]
            },
            {
              "id": "q12",
              "number": 12,
              "prompt": "When does the festival officially begin?",
              "options": [
                { "key": "A", "text": "10 am" },
                { "key": "B", "text": "11 am" },
                { "key": "C", "text": "midday" }
              ],
              "acceptedAnswers": ["B"]
            },
            {
              "id": "q13",
              "number": 13,
              "prompt": "The money raised this year will pay for",
              "options": [
                { "key": "A", "text": "a new library." },
                { "key": "B", "text": "a playground." },
                { "key": "C", "text": "repairs to the community hall." }
              ],
              "acceptedAnswers": ["C"]
            },
            {
              "id": "q14",
              "number": 14,
              "prompt": "Visitors are advised to",
              "options": [
                { "key": "A", "text": "travel by bus." },
                { "key": "B", "text": "park at the station." },
                { "key": "C", "text": "come by bicycle." }
              ],